{
  "firm": {
    "name": "We Law S.C.",
    "operatingSystem": "Hermes We Law OS",
    "masterRole": "master",
    "matterOwnerRole": "master",
    "paperclipAdapterType": "hermes_local",
    "controller": {
      "displayName": "Hermes Director",
      "paperclipWorker": false,
      "responsibilities": [
        "Receive the lawyer's Telegram, field, Drive and project instructions.",
        "Create or update the main Paperclip matter issue.",
        "Route work to the legal-firm workers without asking the lawyer to choose agents.",
        "Keep final reporting honest about blockers, placeholders, approvals and live Workspace status."
      ]
    }
  },
  "allowedMatterStatuses": [
    "prospecto",
    "activo",
    "en_revision",
    "en_cierre",
    "cerrado",
    "rechazado",
    "bloqueado"
  ],
  "allowedPackageStatuses": [
    "draft",
    "review",
    "client-deliverable",
    "blocked",
    "signature-ready"
  ],
  "allowedIssueStatuses": [
    "todo",
    "in_progress",
    "blocked",
    "review",
    "done"
  ],
  "missingInfoTaxonomy": [
    "para_avanzar",
    "para_firma",
    "no_bloqueante"
  ],
  "approvalTypes": [
    "engagement",
    "document",
    "package",
    "payment",
    "matter_close",
    "template_update"
  ],
  "roles": {
    "master": {
      "displayName": "Despacho Legal",
      "paperclipCommentPrefix": "MASTER WORK PRODUCT:",
      "responsibilities": [
        "Own the main matter issue, legal strategy and final integration.",
        "Route work to specialist Paperclip workers with clear internal handoffs.",
        "Keep the live file coherent across Telegram, Paperclip, Workspace and local artifacts.",
        "Escalate blockers, approvals and client-facing decisions to the lawyer."
      ],
      "allowedStatuses": ["todo", "in_progress", "blocked", "review", "done"],
      "requiredArtifacts": [
        { "name": "MATTER_STATUS.md", "type": "status_report", "required": true },
        { "name": "ROUTING_DECISION.json", "type": "routing_record", "required": true },
        { "name": "APPROVAL_REQUESTS.md", "type": "approval_log", "required": true },
        { "name": "DECISION_LOG.md", "type": "decision_log", "required": true }
      ],
      "completionGates": [
        "Every specialist result is summarized or explicitly marked blocked.",
        "Pending approvals are listed before client-facing delivery.",
        "No matter is closed while specialist blockers remain open.",
        "Paperclip writeback uses MASTER WORK PRODUCT."
      ]
    },
    "intake": {
      "displayName": "Recepcionista Juridico",
      "paperclipCommentPrefix": "INTAKE WORK PRODUCT:",
      "responsibilities": [
        "Open or reuse clients and matters.",
        "Extract facts from transcripts before asking the lawyer for missing data.",
        "Collect intake in small parts.",
        "Classify missing information by urgency."
      ],
      "allowedStatuses": ["todo", "in_progress", "blocked", "review", "done"],
      "requiredArtifacts": [
        { "name": "INTAKE_SUMMARY.md", "type": "intake_summary", "required": true },
        { "name": "MISSING_INFO.json", "type": "missing_info", "required": true },
        { "name": "CLIENT_MATTER_LINK.json", "type": "client_matter_link", "required": true }
      ],
      "completionGates": [
        "Client and matter identifiers are known or a blocker is recorded.",
        "Missing fields are classified as para_avanzar, para_firma or no_bloqueante.",
        "Paperclip writeback uses INTAKE WORK PRODUCT."
      ]
    },
    "file": {
      "displayName": "Expediente",
      "paperclipCommentPrefix": "FILE WORK PRODUCT:",
      "responsibilities": [
        "Assemble matter folders and source indexes.",
        "Maintain the live file as the operational source of truth.",
        "Track source documents, Drive links, Google Docs and local artifacts."
      ],
      "allowedStatuses": ["todo", "in_progress", "blocked", "review", "done"],
      "requiredArtifacts": [
        { "name": "EXPEDIENTE_VIVO.md", "type": "live_file", "required": true },
        { "name": "FOLDER_MANIFEST.json", "type": "folder_manifest", "required": true },
        { "name": "SOURCE_INDEX.md", "type": "source_index", "required": true },
        { "name": "VERSION_LOG.md", "type": "version_log", "required": true }
      ],
      "completionGates": [
        "All known sources are indexed.",
        "Folder plan has local or Workspace target paths.",
        "Paperclip writeback uses FILE WORK PRODUCT."
      ]
    },
    "sheets": {
      "displayName": "Data Clerk / Google Sheets",
      "paperclipCommentPrefix": "SHEETS WORK PRODUCT:",
      "responsibilities": [
        "Maintain the master control tables for clients, matters, documents, facts and deliverables.",
        "Use local JSON/CSV fallback when live Google Sheets credentials are unavailable.",
        "Prepare dry-run write plans before any live Workspace mutation."
      ],
      "allowedStatuses": ["todo", "in_progress", "blocked", "review", "done"],
      "requiredArtifacts": [
        { "name": "SHEETS_UPDATE_PLAN.json", "type": "sheets_update_plan", "required": true },
        { "name": "CLIENT_ROW.json", "type": "client_row", "required": true },
        { "name": "MATTER_ROW.json", "type": "matter_row", "required": true },
        { "name": "DOCUMENT_ROWS.json", "type": "document_rows", "required": true },
        { "name": "FACT_ROWS.json", "type": "fact_rows", "required": true }
      ],
      "completionGates": [
        "Every row has a stable logical key.",
        "Live writes are blocked unless Workspace credentials and approval are present.",
        "Paperclip writeback uses SHEETS WORK PRODUCT."
      ]
    },
    "legal_research": {
      "displayName": "Analista Juridico",
      "paperclipCommentPrefix": "RESEARCH WORK PRODUCT:",
      "responsibilities": [
        "Identify applicable Mexican legal basis for the requested matter and documents.",
        "Define document requirements and legal risks before drafting.",
        "Separate legal conclusions from missing factual assumptions."
      ],
      "allowedStatuses": ["todo", "in_progress", "blocked", "review", "done"],
      "requiredArtifacts": [
        { "name": "LEGAL_BASIS_MEMO.md", "type": "legal_basis_memo", "required": true },
        { "name": "DOCUMENT_REQUIREMENTS.json", "type": "document_requirements", "required": true },
        { "name": "RISK_MATRIX.md", "type": "risk_matrix", "required": true }
      ],
      "completionGates": [
        "Every required document has a legal basis or a recorded research blocker.",
        "Legal risks are classified before drafting starts.",
        "Paperclip writeback uses RESEARCH WORK PRODUCT."
      ]
    },
    "documents": {
      "displayName": "Documentos Legales",
      "paperclipCommentPrefix": "LEGAL WORK PRODUCT:",
      "responsibilities": [
        "Read sources and transcripts before drafting.",
        "Extract reusable client and matter data.",
        "Apply requested corrections with traceability.",
        "Draft, revise and package legal documents without reducing substance into summaries."
      ],
      "allowedStatuses": ["todo", "in_progress", "blocked", "review", "done"],
      "requiredArtifacts": [
        { "name": "EVIDENCE_MAP.md", "type": "evidence_map", "required": true },
        { "name": "DATA_LEDGER.json", "type": "data_ledger", "required": true },
        { "name": "CORRECTIONS_APPLIED.md", "type": "corrections_log", "required": true },
        { "name": "PLACEHOLDER_REPORT.md", "type": "placeholder_report", "required": true },
        { "name": "DELIVERABLE_MANIFEST.json", "type": "deliverable_manifest", "required": true },
        { "name": "LEGAL_QA.md", "type": "legal_qa", "required": true }
      ],
      "completionGates": [
        "No final/signature-ready claim is allowed while placeholders remain.",
        "Facts used in documents are source-backed or marked unknown.",
        "Cross-document review is required for packages.",
        "Paperclip writeback uses LEGAL WORK PRODUCT."
      ]
    },
    "privacy": {
      "displayName": "Privacidad y Compliance",
      "paperclipCommentPrefix": "PRIVACY WORK PRODUCT:",
      "responsibilities": [
        "Review privacy, ARCO, sensitive data and compliance obligations.",
        "Map data subjects, controllers, processors and transfer flows.",
        "Block delivery when privacy-sensitive facts are missing."
      ],
      "allowedStatuses": ["todo", "in_progress", "blocked", "review", "done"],
      "requiredArtifacts": [
        { "name": "PRIVACY_DATA_MAP.json", "type": "privacy_data_map", "required": true },
        { "name": "COMPLIANCE_MATRIX.md", "type": "compliance_matrix", "required": true },
        { "name": "ARCO_CHECKLIST.md", "type": "arco_checklist", "required": true },
        { "name": "PRIVACY_QA.md", "type": "privacy_qa", "required": true }
      ],
      "completionGates": [
        "Privacy notices identify data categories, purposes, transfers and ARCO mechanism.",
        "Sensitive data handling is explicit or blocked.",
        "Paperclip writeback uses PRIVACY WORK PRODUCT."
      ]
    },
    "ip_software": {
      "displayName": "IP / Software",
      "paperclipCommentPrefix": "IP SOFTWARE WORK PRODUCT:",
      "responsibilities": [
        "Review software development, licensing, confidentiality and IP ownership issues.",
        "Track deliverables, repositories, third-party components and cotitularity terms.",
        "Block signature-ready status when ownership or scope is ambiguous."
      ],
      "allowedStatuses": ["todo", "in_progress", "blocked", "review", "done"],
      "requiredArtifacts": [
        { "name": "IP_OWNERSHIP_MATRIX.md", "type": "ip_ownership_matrix", "required": true },
        { "name": "SOFTWARE_SCOPE_LEDGER.json", "type": "software_scope_ledger", "required": true },